{
  "schema_version": "1.0",
  "request_id": "req_usage_macos_website_001",
  "measured_at": "2026-07-24T04:00:00Z",
  "platform": "macos",
  "trigger_source": "macos_website_checkpoint",
  "target_type": "website",
  "website_domain": "music.youtube.com",
  "user_provided_context_label": null,
  "label_source": "domain",
  "daily_usage_minutes": 60,
  "continuous_usage_minutes": 12,
  "continuous_usage_is_estimated": false,
  "app_switches_last_10_minutes": 3,
  "local_hour": 14,
  "minutes_since_last_rest": 180,
  "self_reported_energy": null,
  "recent_feedback": [],
  "full_url_included": false,
  "page_title_included": false
}
